{
  "id": "feedback-user-decision-2026-07-05-eradicate-peaks-solo",
  "name": "user-decision-2026-07-05-eradicate-peaks-solo",
  "description": "Promoted from feedback memory .peaks/memory/user-decision-2026-07-05-eradicate-peaks-solo.md: 2026-07-05 user 决定\"彻底去根\"——打破 rename spec AC-10 不动 .peaks/memory/ 的硬规则,107 文件全部 peaks-code → peaks-code",
  "phases": [
    "apply"
  ],
  "gates": [
    {
      "id": "rule-source-present",
      "phase": "apply",
      "check": {
        "type": "file-exists",
        "path": ".peaks/memory/user-decision-2026-07-05-eradicate-peaks-solo.md"
      }
    }
  ]
}