{
  "id": "feedback-a-review-that-measured-against-the-real-artifact",
  "name": "a-review-that-measured-against-the-real-artifact",
  "description": "Promoted from feedback memory .peaks/memory/a-review-that-measured-against-the-real-artifact.md: 派去\"测量\"的评审 agent 把生产产物当草稿纸，把 2054 行灌进真实 history 文件；随后它看见了污染却算错单位、归因给别人；派发指令里没有任何一条禁止写真实产物",
  "phases": [
    "apply"
  ],
  "gates": [
    {
      "id": "rule-source-present",
      "phase": "apply",
      "check": {
        "type": "file-exists",
        "path": ".peaks/memory/a-review-that-measured-against-the-real-artifact.md"
      }
    }
  ]
}